{
  "contract_version": 1,
  "evidence_bindings": [],
  "exception_id": "research-exception",
  "expires_at": "2026-09-30",
  "generation_id": "7fe57a7fccc3da5a30f3d7cc275c0fb459735a4b0a0b3745fc58aaf39e95ffd2",
  "manifest_digest_sha256": "b99cb09c5063f7b7af898ad947342e84f5593f51027ce39a636b20ce631b9644",
  "permitted_action": "allow",
  "policy_binding": {
    "family": "risk_policy_v1",
    "generation_id": "7c3b946511bb7b7a5b08dd97faeb4686d666f541633f9501b8cd24576bd101d0",
    "manifest_digest_sha256": "ce6bc4ba894893c60a36877ee59de789a39529c483d8ee134893929e448b93a5"
  },
  "producer": {
    "created_at": "2026-09-06T00:00:00Z",
    "producer_code_fingerprint": "0000000000000000000000000000000000000000000000000000000000000000",
    "run_id": "00000000-0000-0000-0000-000000000001"
  },
  "reason": "controlled research exception",
  "review_binding": {
    "family": "risk_review_decision_v1",
    "generation_id": "b84bd565c6ab9b203be8095858be7980fcbdb3a532cc27dd040bd75f1d30f352",
    "manifest_digest_sha256": "b455f85c0e783f91932c31d43ea8c4344790a92e466c75c45aceefb7e4496c10"
  },
  "rule_id": "portfolio_gross_exposure_limit",
  "schema_version": "1.0.0",
  "scope_id": "research",
  "scope_type": "portfolio",
  "serialization_profile": "json-canonical-v1",
  "status": "approved"
}
